{
  "SchemaVersion": "1.0",
  "ContractKind": "NetOffice.WrapperCompatibilityLedger",
  "Api": "MSDATASRC",
  "Entries": [
    {
      "LogicalId": "MSDATASRCApi.Utils.ProjectInfo",
      "RecordKind": "type",
      "Source": "Utils/ProjectInfo.cs",
      "Status": "extracted",
      "ExpectedMatchCount": 1,
      "Facet": null,
      "Rationale": null,
      "Provenance": null,
      "ApprovedBy": null
    },
    {
      "LogicalId": "MSDATASRCApi.Utils.ProjectInfo::constructor:ProjectInfo()",
      "RecordKind": "member",
      "Source": "Utils/ProjectInfo.cs",
      "Status": "extracted",
      "ExpectedMatchCount": 1,
      "Facet": null,
      "Rationale": null,
      "Provenance": null,
      "ApprovedBy": null
    },
    {
      "LogicalId": "MSDATASRCApi.Utils.ProjectInfo::method:Contains(Type type)",
      "RecordKind": "member",
      "Source": "Utils/ProjectInfo.cs",
      "Status": "extracted",
      "ExpectedMatchCount": 1,
      "Facet": null,
      "Rationale": null,
      "Provenance": null,
      "ApprovedBy": null
    },
    {
      "LogicalId": "MSDATASRCApi.Utils.ProjectInfo::method:Contains(string className)",
      "RecordKind": "member",
      "Source": "Utils/ProjectInfo.cs",
      "Status": "extracted",
      "ExpectedMatchCount": 1,
      "Facet": null,
      "Rationale": null,
      "Provenance": null,
      "ApprovedBy": null
    },
    {
      "LogicalId": "MSDATASRCApi.Utils.ProjectInfo::property:Assembly",
      "RecordKind": "member",
      "Source": "Utils/ProjectInfo.cs",
      "Status": "extracted",
      "ExpectedMatchCount": 1,
      "Facet": null,
      "Rationale": null,
      "Provenance": null,
      "ApprovedBy": null
    },
    {
      "LogicalId": "MSDATASRCApi.Utils.ProjectInfo::property:AssemblyAttribute",
      "RecordKind": "member",
      "Source": "Utils/ProjectInfo.cs",
      "Status": "extracted",
      "ExpectedMatchCount": 1,
      "Facet": null,
      "Rationale": null,
      "Provenance": null,
      "ApprovedBy": null
    },
    {
      "LogicalId": "MSDATASRCApi.Utils.ProjectInfo::property:AssemblyName",
      "RecordKind": "member",
      "Source": "Utils/ProjectInfo.cs",
      "Status": "extracted",
      "ExpectedMatchCount": 1,
      "Facet": null,
      "Rationale": null,
      "Provenance": null,
      "ApprovedBy": null
    },
    {
      "LogicalId": "MSDATASRCApi.Utils.ProjectInfo::property:AssemblyNamespace",
      "RecordKind": "member",
      "Source": "Utils/ProjectInfo.cs",
      "Status": "extracted",
      "ExpectedMatchCount": 1,
      "Facet": null,
      "Rationale": null,
      "Provenance": null,
      "ApprovedBy": null
    },
    {
      "LogicalId": "MSDATASRCApi.Utils.ProjectInfo::property:ComponentGuid",
      "RecordKind": "member",
      "Source": "Utils/ProjectInfo.cs",
      "Status": "extracted",
      "ExpectedMatchCount": 1,
      "Facet": null,
      "Rationale": null,
      "Provenance": null,
      "ApprovedBy": null
    },
    {
      "LogicalId": "MSDATASRCApi.Utils.ProjectInfo::property:Dependencies",
      "RecordKind": "member",
      "Source": "Utils/ProjectInfo.cs",
      "Status": "extracted",
      "ExpectedMatchCount": 1,
      "Facet": null,
      "Rationale": null,
      "Provenance": null,
      "ApprovedBy": null
    },
    {
      "LogicalId": "NetOffice.MSDATASRCApi.DataSource",
      "RecordKind": "type",
      "Source": "Interfaces/DataSource.cs",
      "Status": "extracted",
      "ExpectedMatchCount": 1,
      "Facet": null,
      "Rationale": null,
      "Provenance": null,
      "ApprovedBy": null
    },
    {
      "LogicalId": "NetOffice.MSDATASRCApi.DataSource::constructor:DataSource()",
      "RecordKind": "member",
      "Source": "Interfaces/DataSource.cs",
      "Status": "extracted",
      "ExpectedMatchCount": 1,
      "Facet": null,
      "Rationale": null,
      "Provenance": null,
      "ApprovedBy": null
    },
    {
      "LogicalId": "NetOffice.MSDATASRCApi.DataSource::constructor:DataSource(Core factory, ICOMObject parentObject, COMProxyShare proxyShare)",
      "RecordKind": "member",
      "Source": "Interfaces/DataSource.cs",
      "Status": "extracted",
      "ExpectedMatchCount": 1,
      "Facet": null,
      "Rationale": null,
      "Provenance": null,
      "ApprovedBy": null
    },
    {
      "LogicalId": "NetOffice.MSDATASRCApi.DataSource::constructor:DataSource(Core factory, ICOMObject parentObject, object comProxy)",
      "RecordKind": "member",
      "Source": "Interfaces/DataSource.cs",
      "Status": "extracted",
      "ExpectedMatchCount": 1,
      "Facet": null,
      "Rationale": null,
      "Provenance": null,
      "ApprovedBy": null
    },
    {
      "LogicalId": "NetOffice.MSDATASRCApi.DataSource::constructor:DataSource(Core factory, ICOMObject parentObject, object comProxy, NetRuntimeSystem.Type comProxyType)",
      "RecordKind": "member",
      "Source": "Interfaces/DataSource.cs",
      "Status": "extracted",
      "ExpectedMatchCount": 1,
      "Facet": null,
      "Rationale": null,
      "Provenance": null,
      "ApprovedBy": null
    },
    {
      "LogicalId": "NetOffice.MSDATASRCApi.DataSource::constructor:DataSource(ICOMObject parentObject, object comProxy)",
      "RecordKind": "member",
      "Source": "Interfaces/DataSource.cs",
      "Status": "extracted",
      "ExpectedMatchCount": 1,
      "Facet": null,
      "Rationale": null,
      "Provenance": null,
      "ApprovedBy": null
    },
    {
      "LogicalId": "NetOffice.MSDATASRCApi.DataSource::constructor:DataSource(ICOMObject parentObject, object comProxy, NetRuntimeSystem.Type comProxyType)",
      "RecordKind": "member",
      "Source": "Interfaces/DataSource.cs",
      "Status": "extracted",
      "ExpectedMatchCount": 1,
      "Facet": null,
      "Rationale": null,
      "Provenance": null,
      "ApprovedBy": null
    },
    {
      "LogicalId": "NetOffice.MSDATASRCApi.DataSource::constructor:DataSource(ICOMObject replacedObject)",
      "RecordKind": "member",
      "Source": "Interfaces/DataSource.cs",
      "Status": "extracted",
      "ExpectedMatchCount": 1,
      "Facet": null,
      "Rationale": null,
      "Provenance": null,
      "ApprovedBy": null
    },
    {
      "LogicalId": "NetOffice.MSDATASRCApi.DataSource::constructor:DataSource(string progId)",
      "RecordKind": "member",
      "Source": "Interfaces/DataSource.cs",
      "Status": "extracted",
      "ExpectedMatchCount": 1,
      "Facet": null,
      "Rationale": null,
      "Provenance": null,
      "ApprovedBy": null
    },
    {
      "LogicalId": "NetOffice.MSDATASRCApi.DataSource::method:addDataSourceListener(NetOffice.MSDATASRCApi.DataSourceListener pDSL)",
      "RecordKind": "member",
      "Source": "Interfaces/DataSource.cs",
      "Status": "extracted",
      "ExpectedMatchCount": 1,
      "Facet": null,
      "Rationale": null,
      "Provenance": null,
      "ApprovedBy": null
    },
    {
      "LogicalId": "NetOffice.MSDATASRCApi.DataSource::method:getDataMember(string bstrDM, Guid riid)",
      "RecordKind": "member",
      "Source": "Interfaces/DataSource.cs",
      "Status": "extracted",
      "ExpectedMatchCount": 1,
      "Facet": null,
      "Rationale": null,
      "Provenance": null,
      "ApprovedBy": null
    },
    {
      "LogicalId": "NetOffice.MSDATASRCApi.DataSource::method:getDataMemberCount()",
      "RecordKind": "member",
      "Source": "Interfaces/DataSource.cs",
      "Status": "extracted",
      "ExpectedMatchCount": 1,
      "Facet": null,
      "Rationale": null,
      "Provenance": null,
      "ApprovedBy": null
    },
    {
      "LogicalId": "NetOffice.MSDATASRCApi.DataSource::method:getDataMemberName(Int32 lIndex)",
      "RecordKind": "member",
      "Source": "Interfaces/DataSource.cs",
      "Status": "extracted",
      "ExpectedMatchCount": 1,
      "Facet": null,
      "Rationale": null,
      "Provenance": null,
      "ApprovedBy": null
    },
    {
      "LogicalId": "NetOffice.MSDATASRCApi.DataSource::method:removeDataSourceListener(NetOffice.MSDATASRCApi.DataSourceListener pDSL)",
      "RecordKind": "member",
      "Source": "Interfaces/DataSource.cs",
      "Status": "extracted",
      "ExpectedMatchCount": 1,
      "Facet": null,
      "Rationale": null,
      "Provenance": null,
      "ApprovedBy": null
    },
    {
      "LogicalId": "NetOffice.MSDATASRCApi.DataSource::property:InstanceType",
      "RecordKind": "member",
      "Source": "Interfaces/DataSource.cs",
      "Status": "extracted",
      "ExpectedMatchCount": 1,
      "Facet": null,
      "Rationale": null,
      "Provenance": null,
      "ApprovedBy": null
    },
    {
      "LogicalId": "NetOffice.MSDATASRCApi.DataSource::property:LateBindingApiWrapperType",
      "RecordKind": "member",
      "Source": "Interfaces/DataSource.cs",
      "Status": "extracted",
      "ExpectedMatchCount": 1,
      "Facet": null,
      "Rationale": null,
      "Provenance": null,
      "ApprovedBy": null
    },
    {
      "LogicalId": "NetOffice.MSDATASRCApi.DataSourceListener",
      "RecordKind": "type",
      "Source": "Interfaces/DataSourceListener.cs",
      "Status": "extracted",
      "ExpectedMatchCount": 1,
      "Facet": null,
      "Rationale": null,
      "Provenance": null,
      "ApprovedBy": null
    },
    {
      "LogicalId": "NetOffice.MSDATASRCApi.DataSourceListener::constructor:DataSourceListener()",
      "RecordKind": "member",
      "Source": "Interfaces/DataSourceListener.cs",
      "Status": "extracted",
      "ExpectedMatchCount": 1,
      "Facet": null,
      "Rationale": null,
      "Provenance": null,
      "ApprovedBy": null
    },
    {
      "LogicalId": "NetOffice.MSDATASRCApi.DataSourceListener::constructor:DataSourceListener(Core factory, ICOMObject parentObject, COMProxyShare proxyShare)",
      "RecordKind": "member",
      "Source": "Interfaces/DataSourceListener.cs",
      "Status": "extracted",
      "ExpectedMatchCount": 1,
      "Facet": null,